{
    "$schema": "https://json-schema.org/draft/2020-12/schema",
    "$id": "https://pneuma-lab.local/schemas/cloud-input-inventory-plan.schema.json",
    "title": "Cloud Input Inventory Plan",
    "description": "Exact, no-payload metadata-discovery action used to enumerate immutable upstream snapshot bytes before a real Step 5B input lock can exist.",
    "type": "object",
    "x-pneuma-schema-kind": "cloud-manifest",
    "x-pneuma-version": "0.1.0",
    "required": ["record_kind", "schema_version", "frozen_timestamp", "action_id", "provider", "region", "purpose", "sources", "outputs", "network_policy", "cost_ceiling_usd", "max_retries"],
    "properties": {
        "record_kind": {"const": "cloud_input_inventory_plan"},
        "schema_version": {"const": "0.1.0"},
        "frozen_timestamp": {"$ref": "#/$defs/timestamp"},
        "action_id": {"type": "string", "pattern": "^[a-z0-9][a-z0-9-]{2,79}$"},
        "provider": {"const": "aws"},
        "region": {"type": "string", "pattern": "^[a-z]{2}(?:-gov)?-[a-z]+-\\d$"},
        "purpose": {"const": "resolve_inventory_metadata_only"},
        "sources": {"type": "array", "minItems": 1, "items": {"$ref": "#/$defs/source"}},
        "outputs": {"type": "array", "minItems": 1, "uniqueItems": true, "items": {"type": "string", "pattern": "^(?!/)(?!.*\\.\\.)[^\\\\]+$"}},
        "network_policy": {
            "type": "object",
            "required": ["allowed_hosts", "payload_downloads", "model_weight_downloads", "container_layer_downloads", "experiment_execution"],
            "properties": {
                "allowed_hosts": {"type": "array", "minItems": 1, "uniqueItems": true, "items": {"type": "string", "minLength": 1}},
                "payload_downloads": {"const": false},
                "model_weight_downloads": {"const": false},
                "container_layer_downloads": {"const": false},
                "experiment_execution": {"const": false}
            },
            "additionalProperties": false
        },
        "cost_ceiling_usd": {"type": "number", "minimum": 0, "maximum": 1},
        "max_retries": {"type": "integer", "minimum": 0, "maximum": 1}
    },
    "additionalProperties": false,
    "$defs": {
        "timestamp": {"type": "string", "pattern": "^\\d{4}-\\d{2}-\\d{2}T\\d{2}:\\d{2}:\\d{2}(?:\\.\\d+)?Z$"},
        "source": {
            "type": "object",
            "required": ["role", "repository", "revision", "service", "inventory_operation"],
            "properties": {
                "role": {"enum": ["subject_model", "tokenizer", "simulator_model", "swe_harness", "swe_dataset", "repo_launcher", "tau2_harness", "worker_base"]},
                "repository": {"type": "string", "minLength": 3},
                "revision": {"type": "string", "pattern": "^(?:[0-9a-f]{40}|sha256:[0-9a-f]{64})$"},
                "service": {"enum": ["huggingface", "github", "docker_registry"]},
                "inventory_operation": {"enum": ["list_revision_tree_with_lfs_oids", "list_git_tree_with_blob_oids", "read_oci_manifest"]}
            },
            "additionalProperties": false
        }
    }
}
