{"action_id":"step5b-inventory-metadata-001","cost_ceiling_usd":0.0,"frozen_timestamp":"2026-08-01T00:00:00Z","max_retries":1,"network_policy":{"allowed_hosts":["api.github.com","huggingface.co","registry-1.docker.io","auth.docker.io"],"container_layer_downloads":false,"experiment_execution":false,"model_weight_downloads":false,"payload_downloads":false},"outputs":["receipts/step5b/inventory-metadata.json","receipts/step5b/inventory-metadata.sha256"],"provider":"aws","purpose":"resolve_inventory_metadata_only","record_kind":"cloud_input_inventory_plan","region":"us-east-1","schema_version":"0.1.0","sources":[{"inventory_operation":"list_git_tree_with_blob_oids","repository":"microsoft/RepoLaunch","revision":"7735b1e7363dd3bbc69bd0ef80db646a2ae391fd","role":"repo_launcher","service":"github"},{"inventory_operation":"list_revision_tree_with_lfs_oids","repository":"Qwen/Qwen3.5-9B","revision":"c202236235762e1c871ad0ccb60c8ee5ba337b9a","role":"simulator_model","service":"huggingface"},{"inventory_operation":"list_revision_tree_with_lfs_oids","repository":"Qwen/Qwen3.6-35B-A3B-FP8","revision":"95a723d08a9490559dae23d0cff1d9466213d989","role":"subject_model","service":"huggingface"},{"inventory_operation":"list_revision_tree_with_lfs_oids","repository":"SWE-bench-Live/MultiLang","revision":"608f7ae9ab8ea1f9f0d030fe04562cf6bd1a0c8b","role":"swe_dataset","service":"huggingface"},{"inventory_operation":"list_git_tree_with_blob_oids","repository":"microsoft/SWE-bench-Live","revision":"70ec57e852e3f2d195790fe71f553e272c691833","role":"swe_harness","service":"github"},{"inventory_operation":"list_git_tree_with_blob_oids","repository":"sierra-research/tau2-bench","revision":"fc0055dc4e0a316c3f83133267fbd6faaa770992","role":"tau2_harness","service":"github"},{"inventory_operation":"list_revision_tree_with_lfs_oids","repository":"Qwen/Qwen3.6-35B-A3B-FP8","revision":"95a723d08a9490559dae23d0cff1d9466213d989","role":"tokenizer","service":"huggingface"},{"inventory_operation":"read_oci_manifest","repository":"docker.io/vllm/vllm-openai","revision":"sha256:7a0f0fdd2771464b6976625c2b2d5dd46f566aa00fbc53eceab86ef50883da90","role":"worker_base","service":"docker_registry"}]}
